{
  "schema_version": "1.1",
  "id": "approval-order-pb-brief",
  "order_id": "order-pb",
  "target_type": "BRIEF",
  "target_version_id": "brief-pb-v1",
  "target_content_hash": "9b7c2b0111360714dfbc9cbdbc755b693b11e067f32771cb226126fdcd1ffb49",
  "context_brief_version_id": null,
  "context_brief_content_hash": null,
  "approved_by": "local_user",
  "approved_at": "2026-07-12T12:10:00Z"
}
