{
  "schema_version": "1.1",
  "id": "approval-order-pa-brief",
  "order_id": "order-pa",
  "target_type": "BRIEF",
  "target_version_id": "brief-pa-v1",
  "target_content_hash": "695088adceedcb49d1d494b352f2ee332da98dd953a7b997b42b36b76147854d",
  "context_brief_version_id": null,
  "context_brief_content_hash": null,
  "approved_by": "local_user",
  "approved_at": "2026-07-12T12:10:00Z"
}
